{
  "schema_version": "ng039-ipc-inventory/v2",
  "run_id": "NG039-D2-000000000001",
  "phase": "pre",
  "complete": true,
  "is_empty": true,
  "sysv_ids": {
    "shm": [],
    "sem": [],
    "msg": []
  },
  "dev_shm_entries": [],
  "error": null,
  "proc_sysvipc_sha256": {
    "shm": "077d15ecfcdf9bd541be33eb890f19f7eb8dbc6db863a453e4e4c196ee3cacc0",
    "sem": "839ac2570a6ecb419587f25fa1868c8b016dd836eed59ef7e09a8cbc0ae4f9aa",
    "msg": "e1a7ddee2c9751156074d17c92560e07fe10be00eafe3621b126ed8df6a55593"
  },
  "proc_sysvipc_raw_b64": {
    "shm": "U1lOVEhFVElDIHNobSBpbnZlbnRvcnkgc2hhcGUgZml4dHVyZQo=",
    "sem": "U1lOVEhFVElDIHNlbSBpbnZlbnRvcnkgc2hhcGUgZml4dHVyZQo=",
    "msg": "U1lOVEhFVElDIG1zZyBpbnZlbnRvcnkgc2hhcGUgZml4dHVyZQo="
  }
}
